id,grupo_tcc,curso_fonte,titulo,tipo_tcc,autor,orientador,coorientador,banca_examinadora,ano_defesa,semestre_defesa,paginas,palavras_chave,resumo_disponivel,resumo,tcc_digital,formato,disponivel_integral,link,arquivo,pesquisador,observacoes_acesso,observacoes_analise,carimbo,em_ambos_forms,fonte,conflitos,ano_num,pag_num,topico_dom,topico_prob,cluster,tem_indigena
32,Pedagogia,Pedagogia,JOGOS E BRINCADEIRAS NO PROCESSO DE APRENDIZAGEM NA PRÉ-ESCOLA,Artigo científico,Fabiana Valente de Mesquita,Sebastião Monteiro Oliveira,Não se aplica,Não informado,2018,Não informado,15,Jogos; Brincadeiras; Práticas Pedagógicas; Ensino- Aprendizagem.,Sim,"Este artigo apresenta uma pesquisa bibliográfica referenciada em teóricos que discutem as metodologias de ensino-aprendizagem infantil, trazendo como objeto de estudo, a ludicidade como ferramenta de estímulo à aprendizagem. Nesta perspectiva, a ludicidade apresenta-se como uma atividade importante para o desenvolvimento infantil, levando a criança de encontro ao conhecimento, à socialização e ao desenvolvimento de seu caráter, ratificando que esse recurso metodológico está longe de ser simples brincadeiras sem qualquer relação científica. A disposto disso, explanou-se sobre os reais subsídios desta temática, destacando a sua importância para educação infantil, dialogando concomitantemente sobre os jogos e brincadeiras pedagógicas utilizados no processo de ensino aprendizagem. Os resultados apontam que os jogos e as brincadeiras são atividades físicas e cognitivas constituídas por um sistema regras pré-definidas através dos méritos, com os quais são avaliadas pelos erros e acertos dos participantes, e mesmo com características mecanizadas, dentro de um sistema padronizado e fechado, auxiliam o processo de ensino-aprendizagem da educação infantil. Contudo, o educador, utilizando-se das diversas possibilidades e estratégias que a ludicidade dispõe, tem a oportunidade de explorar novas técnicas e criar novos mecanismos, dentro do espaço escolar, que estimulem o processo de desenvolvimento das crianças na educação infantil, fazendo com que as novas práticas enriqueçam o cotidiano escolar.",Sim,Digital nativo,Sim,https://drive.google.com/file/d/19p44fGLGl3Lr5IIeqSv7NMybskF2Rxiq/view?usp=sharing,https://drive.google.com/open?id=1hlmtDfIwxGgHb15EX2jQauGStLMIFc3C,Jelynne Ewellyn Felipe Pinto,,Registro consolidado em 2026-06-17: duplicata id 46 (Form2) removida.,12/06/2026 08:47:35,Não,Form1,,2018.0,15.0,1.0,0.9905902267187336,3.0,False
33,Pedagogia,Pedagogia,EXPERIÊNCIA FORMADORA: CONTRIBUIÇÕES DO ESTÁGIO SUPERVISIONADO DO CURSO DE LICENCIATURA EM PEDAGOGIA DA UNIVERSIDADE FEDERAL DE RORAIMA,Artigo científico,Geoames Ribeiro Silva,Elizangela da Silva Barboza Ramos,Não se aplica,Não informado,2018,Não informado,19,Experiência Formadora; Estágio Supervisionado; Educação Infantil.,Sim,"O presente trabalho teve o objetivo de evidenciar as contribuições do Estágio Supervisionado no processo formativo de alunos do Curso de Licenciatura em Pedagogia da Universidade Federal de Roraima-UFRR. Escolhi relatar e refletir sobre as experiências do Estágio Supervisionado l em Educação Infantil por ser o primeiro estágio do curso e, portanto, o que gerava maior expectativa em meu processo formativo. A seleção deste tema foi originada pelo fato de considerar o estágio um processo de formação de grande importância na minha trajetória acadêmica e, principalmente, pelo resultado satisfatório que obtive neste processo, onde os meus anseios a respeito do estágio supervisionado foram superados, tornando-se enriquecedora esta etapa percorrida. Trata-se de um trabalho com abordagem qualitativa baseado em estudos realizados por autores como Pimenta e Gonçalves (1990), Galardini e Giovannini (2002), Osteto (2008) entre outros, enfatizando a importância do estágio supervisionado e práticas pedagógicas em Educação Infantil. A realização deste trabalho demostra que a experiência no estágio supervisionado do Curso de Pedagogia é fundamental para que o discente da graduação tenha uma aproximação do contexto da futura profissão e possa desenvolver conhecimentos sobre as práticas pedagógicas utilizadas no âmbito educacional.",Sim,Digital nativo,Sim,https://drive.google.com/file/d/1BRAU7VjQsV0SGA8ojafw3J3NFtvDFnlz/view?usp=sharing,https://drive.google.com/open?id=1effRtHS70KzwFVWOpn_G4gKIUNe9gRRN,Jelynne Ewellyn Felipe Pinto,Arquivo disponível de forma digital sem restrições de acesso,,12/06/2026 08:54:34,Sim,Form1+Form2,ano_defesa: F1='2018' vs F2='Não informado',2018.0,19.0,3.0,0.9902449020190592,2.0,False
34,Pedagogia,Pedagogia,REFLEXÕES SOBRE AS EXPERIÊNCIAS NO ESTÁGIO CURRICULAR DO CURSO DE PEDAGOGIA NAS MODALIDADES PRESENCIAL E ON-LINE,,Alcimara Eliane de Souza Silva,Edlauva Oliveira dos Santos,Não se aplica.,Não informado,2022,Não informado,30,Estágio Curricular Supervisionado; Curso de Pedagogia; Modalidade presencial; Modalidade on-line,Sim,"Este texto caracteriza-se como Trabalho de Conclusão de Curso (TCC), para obter o título de pedagoga no Curso de Pedagogia da Universidade Federal de Roraima (UFRR). Se insere nas discussões sobre a formação inicial de professores e tem como objeto de estudo as experiências no estágio curricular supervisionado nas modalidades presencial e on-line. Tem como objetivo refletir sobre as contribuições dos Estágios I e II, realizados nas modalidades presencial e on-line respectivamente, na minha formação inicial. Discute centralmente o conceito de Estágio Curricular Supervisionado como componente curricular obrigatório da formação de professores, tendo como base os estudos de Pimenta, (1997); Pimenta; Lima, (2000), (2012); Saviani, (2007); Santos, (2009). Consiste em um relato de experiência que tem como fontes de dados: 1) o Projeto Pedagógico do Curso de Pedagogia da UFRR (UFRR, 2009); 2) a Política de Estágio do Curso de Pedagogia (UFRR, 2010); 3) meus relatórios dos Estágios I e II; 4) diário de campo construído durante os estágios e durante a escrita do TCC foi enriquecido com outras memórias. O estudo conclui que o estágio é uma etapa essencial no processo da graduação, sendo o momento em que o futuro professor estabelece relações entre a teoria e a prática, favorecendo assim a construção da identidade profissional do futuro pedagogo e a construção de conhecimentos sobre a docência.",Sim,Digital nativo,Sim,Drive disponibilizado pelo professor,https://drive.google.com/open?id=1zp2KpxQZT4LSkO5dCl5HJR4jZzVxdDJS,Karimy Manuelle da Silva Balbino,Não econtrado no repositório digital da UFRR.,,15/05/2026 14:33:15,Não,Form2,,2022.0,30.0,3.0,0.9904460326182354,2.0,False
35,Pedagogia,Pedagogia,PROGRAMA RESIDÊNCIA PEDAGÓGICA: RELATO DE UMA EXPERIÊNCIA NOS ANOS INICIAIS DO ENSINO FUNDAMENTAL NO CONTEXTO DA PANDEMIA DE COVID-19.,,Amanda Macêna da Silva.,Edlauva Oliveira dos Santos,NAO SE APLICA,NÃO INFORMADO,2021,Não informado,31,Formação Docente; Residência Pedagógica; Curso de Pedagogia; Ensino Remoto; Anos iniciais do Ensino Fundamental.,Sim,"Neste relato descrevo as experiências vividas por mim no Programa Residência Pedagógica - PRP, que é um programa executado pela Coordenação de Aperfeiçoamento de Pessoas de Nível Superior – CAPES em parceria com a Universidade Federal de Roraima – UFRR. As experiências relatadas fazem parte do Subprojeto Alfabetização do Curso de Pedagogia da UFRR, as atividades foram realizadas em duas escolas da Rede Municipal de Ensino de Boa Vista-RR, que aconteceu no Ensino Remoto devido a Pandemia pelo COVID- 19 nos meses de outubro de 2020 a março de 2021 e de abril a setembro de 2021. Tem como objetivo analisar como as experiências vivenciadas no âmbito do Programa Residência Pedagógica contribuíram minha formação docente. Para a produção do relato, busquei informações em documentos sobre o PRP, registros sobre a escola-campo e o diário de campo. Organizo o relato em três seções: A formação docente e as possíveis contribuições do Programa Residência Pedagógica (PRP); O subprojeto Alfabetização do curso de Pedagogia da Universidade Federal de Roraima (UFRR) e a escola campo onde se desenvolveu a experiência relatada; Reflexões sobre as atividades desenvolvidas no âmbito do PRP: o preparo, o planejamento e a regência. Com isso, a experiência como residente proporcionou-me desafios e contribuições para a minha aprendizagem formativa em meio a pandemia.",Sim,Digital nativo,Sim,https://drive.google.com/drive/folders/1ikWM5IT1iGw9qHeIX34-JFsD-Eanr1Pn,https://drive.google.com/open?id=1KeK9sKgR5jqaqsmJ_hI754MZXxtvSQ9M,JELYNNE EWELLYN FELIPE PINTO,NÃO TEM,,15/05/2026 14:34:53,Não,Form2,,2021.0,31.0,1.0,0.8054634841426652,2.0,False
36,Pedagogia,Pedagogia,ATRIBUIÇÕES DO COORDENADOR PEDAGÓGICO NAS ESCOLAS MUNICIPAIS DE BOA VISTA-RR: UMA ANÁLISE A PARTIR DO MANUAL DA ESCOLA DO IAB,,Bruna Carolina Silva Magalhães,Edlauva Oliveira dos Santos,Não se aplica.,Não informado.,2019,Não informado,33,"Supervisão Educacional; Coordenação Pedagógica; Sistemas Privados de Ensino, Roraima; Manual da Escola do IAB",Sim,"O presente trabalho trata das atribuições do Coordenador Pedagógico, nas escolas municipais de Boa Vista-RR, tendo como objeto de estudo as atribuições da Coordenação Pedagógica no Manual da Escola elaborado pelo Instituto Alfa e Beto (IAB), que desde 2013 é o responsável pelo fornecimento do material educacional às referidas escolas. Prima-se com isso, analisar em que termos as atribuições do Coordenador Pedagógico previstas no Manual da Escola do IAB se aproximam das concepções de Supervisão e Coordenação Pedagógica. Dessa forma, utilizou-se uma metodologia de pesquisa que se consistiu numa revisão bibliográfica e de análise documental com fulcro na compreensão dos conceitos de Supervisão Educacional e Coordenação Pedagógica, além do movimento de expansão da adoção de sistemas privados de ensino por redes públicas. O trabalho permitiu esclarecer que, as atribuições do Coordenador Pedagógico previstas no citado manual tendem para uma prática mais condizente com um modelo retrógrado de Supervisão em vez da prática defendida pela Coordenação Pedagógica em sua contemporaneidade, sendo compreendida como uma atividade de mediação e articulação do trabalho pedagógico na escola. Também foi possível verificar que, com a adesão ao IAB pela Prefeitura de Boa Vista o processo educativo passou a ser gerenciado com status de empresa, retirando da rede municipal a autonomia de coordenar a pasta direcionada ao ensino e às reais necessidades dos sujeitos.",Sim,Digital nativo,Sim,Drive disponibilizado pelo professor.,https://drive.google.com/open?id=1moT0BcR3EVBen1ribPEWsKBlONJx3R0F,Karimy Manuelle da Silva Balbino.,Não disponivel no repositório digital da UFRR.,,15/05/2026 14:42:22,Não,Form2,,2019.0,33.0,1.0,0.9896520746172895,2.0,False
37,Pedagogia,Pedagogia,EDUCAÇÃO ESCOLAR INDÍGENA: DISCUSSÃO E RELATO DE VIVÊNCIA,,Sarah Pereira da Silva,Maria Socorro Alves de Souza,NAO SE APLICA,NAO INFORMADO,2023,Não informado,22,Educação. Escola indígena. Vivência.,Sim,"Este artigo tem como objetivo, discutir acerca da educação escolar indígena, assim como relatar a vivência enquanto aluna indígena em escola indígena da Comunidade de Araçá da Serra, no município de Normandia, no Estado de Roraima. O estudo apresenta como problema norteador, a seguinte questão: o que caracteriza a Educação Escolar Indígena, e como é a educação em terra indígena a partir da realidade vivida por aluna indígena? A partir desse questionamento, delineia-se a discussão sobre a necessária atenção e direcionamento de políticas públicas que atendam e respeitem as peculiaridades dos povos indígenas. A metodologia adotada foi de cunho qualitativo, bibliográfico e documental. Quanto aos resultados obtidos, constatou-se, que se faz necessário a criação de espaços com estruturas adequadas à realidade da escola indígena, com infraestrutura e equipamentos que favoreçam a acessibilidade, o atendimento pedagógico e recreativo da comunidade escolar. Ao final do estudo, evidencia-se que a inserção nas escolas indígenas de professores comprometidos e que impulsionem a luta pelos direitos dos indígenas precisa ser garantido.",Sim,Digital nativo,Sim,https://drive.google.com/drive/folders/1ikWM5IT1iGw9qHeIX34-JFsD-Eanr1Pn,https://drive.google.com/open?id=1CNdYIlxHV4UAxuriNFYo_JfITXxIdqHO,JELYNNE EWELLYN FELIPE PINTO,NAO SE APLICA,,15/05/2026 14:45:01,Não,Form2,,2023.0,22.0,2.0,0.7097469645728836,0.0,True
38,Pedagogia,Pedagogia,COORDENAÇÃO PEDAGÓGICA: DESAFIOS E SUPERAÇÃO NO ENSINO REMOTO EM TEMPOS DE PANDEMIA DA COVID-19,,MARINALVA PACHECO DA SILVA,João Paulino da Silva Neto,Não se aplica.,Profa. Dra. Alessandra Peternella Profa. Dra. Edlauva Oliveira dos Santos,2022,Não informado,42,Coordenação Pedagógica; Ensino Remoto; Estágio Supervisionado; Pandemia da Covid-19,Sim,"Este trabalho trata-se de um Relatório-síntese do Estágio Supervisionado IV em Gestão e Coordenação Pedagógica. Tem por objetivo compreender como processou-se o trabalho do coordenador pedagógico em contexto de pandemia da Covid-19 e do ensino remoto emergencial (ERE) em uma Escola Pública de Boa Vista, Roraima. O estudo surgiu por meio de reflexões e observações vivenciadas durante o Estágio Supervisionado Obrigatório IV em Coordenação Pedagógica. As informações sobre o objetivo de estudo foram coletadas durante as atividades do estágio, por meio de entrevistas não estruturadas. Como resultados observou- se que o trabalho do Coordenador Pedagógico não é possível acontecer isoladamente, que é preciso trabalhar em equipe, permitindo a articulação dos diferentes sujeitos escolares com a finalidade de construir, promover, planejar e executar ações que transformem a realidade do ensino aprendizagem em um ensino democrático e de qualidade.",Sim,Digital nativo,Sim,Drive disponibilixado pelo professor.,https://drive.google.com/open?id=1Njk7ScgRZDBHUiazOocIVs-v3kXfigmm,Karimy Manuelle da Silva Balbino.,Não disponível no repositório digital da UFRR.,,15/05/2026 14:50:06,Não,Form2,,2022.0,42.0,1.0,0.8040134993479596,2.0,False
39,Pedagogia,Pedagogia,O ESTÁGIO CURRICULAR NA GESTÃO E COORDENAÇÃO PEDAGÓGICA NO CONTEXTO DA PANDEMIA DE COVID-19: REFLEXÕES SOBRE POSSIBILIDADES E DIFICULDADES,,Darcilene de Souza Aquino,Edlauva Oliveira dos Santos,NAO SE APLICA,NÃO INFORMADO,2021,Não informado,24,Estágio Curricular Supervisionado; Curso de Pedagogia; Gestão Escolar; Coordenação Pedagógica; Ensino Remoto Emergencial.,Sim,"Este trabalho teve como objetivo geral analisar as possibilidades e dificuldades para a realização do Estágio IV do Curso de Pedagogia da Universidade Federal de Roraima (UFRR), com foco na gestão escolar e coordenação pedagógica durante o período de Ensino Remoto Emergencial, o qual foi instituído em virtude da pandemia de Covid-19. Foi aplicado um formulário via Google forms com questões abertas às alunas que cursaram o Estágio IV na modalidade on-line nos semestres 2020.1 e 2021.1. A análise se deu por meio da organização das respostas por pergunta e feita a análise interpretativa. Foi possível verificar que a gestão escolar e a coordenação pedagógica cumprem o papel de melhorar o ambiente e reinventar seu trabalho para continuar o processo educativo, mesmo em meio a uma pandemia. Conclui-se que houve dificuldades de diferentes dimensões para a realização do Estágio, contudo, as estagiárias reconhecem que foi a forma possível de continuar a formação e manter o distanciamento social.",Sim,Digital nativo,Sim,https://drive.google.com/file/d/1v2BOlV7_UR-Vj15dfeRVSe3f7PY6wy39/view?usp=sharing,https://drive.google.com/open?id=11jDJ8Dq13gk4lDoflJ1u29091AOgVFZn,JELYNNE EWELLYN FELIPE PINTO,NÃO TEM RESTRIÇÃO,,15/05/2026 14:52:47,Não,Form2,,2021.0,24.0,1.0,0.7413862147487855,2.0,False
40,Pedagogia,Pedagogia,UMA REFLEXÃO SOBRE O TRABALHO DAS CUIDADORAS POR MEIO DO OLHAR DA CUIDADORA-PEDAGOGA NA CASA MÃE,,JÉSSICA PEREIRA DA SILVA,João Paulino da Silva Neto,Não se aplica.,Prof. Dr. João Paulino da Silva Neto Prof.a Dr.a Alessandra Peternella Prof.a Dr.a Leuda Evangelista de Oliveira,2022,Não informado,23,Cuidadoras. Casa Mãe. Educação Infantil,Sim,"Esta pesquisa tem por objetivo analisar como o trabalho das cuidadoras impactam na Educação Infantil. Os objetivos específicos são: conhecer a Proposta Curricular Municipal para Educação Infantil e observar a práxis das cuidadoras na Casa Mãe. Problematizou-se: como o trabalho das cuidadoras impactam na Educação Infantil? A Educação Infantil está atrelada aos conceitos de infância e criança que vão se construindo ao longo da história através das transformações ocorridas no mundo, seguindo as discussões e legislações que a amparam. A pesquisa tem como campo de estudo uma Casa Mãe da Rede Municipal de Ensino de Boa Vista/Roraima, que atende crianças entre 2 e 4 anos de idade. Usamos para coleta de dados os seguintes instrumentos de pesquisa: entrevista, pesquisa documental e bibliográfica, observação e diário de campo. Como categorias analíticas construídas: a “Proposta Curricular Municipal e BNCC”, “A cuidadora como professora anônima” e “Valorização da cuidadora: transformá-la em professora?” no decorrer das entrevistas. Nas considerações finais, refletimos sobre as atribuições das cuidadoras que estão para além do cuidar e buscamos questionar sobre a valorização e os novos olhares para essa carreira.",Sim,Digital nativo,Sim,Drive disponibilizado pelo professor.,https://drive.google.com/open?id=1LdNqawLD3aAjvcRqWTtyKQigqKWAfHjL,Karimy Manuelle da Silva Balbino,Não consta no repositório digital da UFRR.,,15/05/2026 16:48:42,Não,Form2,,2022.0,23.0,1.0,0.6527011348774318,3.0,False
41,Pedagogia,Pedagogia,FORMAÇÃO DE PROFESSORES NA RESOLUÇÃO CNE/CP No 02/2019 DO MEC,,MARIA JOSÉ SOUZA MONTEIRO,João Paulino da Silva Neto,Não se aplica.,Não informado.,2022,Não informado,19,Formação de Professores; Curso de Pedagogia; Marx.,Sim,"Este artigo tem por objetivo analisar a Resolução CNE/CP no 02/2019 do MEC e seus impactos na formação de professores. Baseado sob a perspectiva dialética de Karl Marx sobre o trabalho, com contribuições de Singer (1987), Scheibe e Durli (2021). Escrever sobre um tema que envolve políticas públicas educativas no atual contexto brasileiro, é desafiador para uma neófita de um trabalho de conclusão do curso, principalmente quando as mudanças impostas pela resolução CNE/CP no 02/2019 causariam engessamento na autonomia das universidades, proporcionando desvalorização e retrocessos na formação do pedagogo, com a nova Resolução CNE/CP no 02/2019 do Ministério da Educação. Ao analisarmos a Resolução CNE/CP no 2, de 20 de dezembro de 2019, de imediato o que observamos foi a descaracterização do curso de Pedagogia de seu papel como formador de professor, desenhada logo nos primeiros artigos. Em uma hermenêutica comparativa com a Resolução CNE/CP No 1, de 15 de maio de 2006, que institui diretrizes para a formação de professores no Curso de Pedagogia, trazendo características próprias, para a formação do Pedagogo com uma formação em docência plena, para exercer sua profissão como educadores em sala de aula e exercendo sua profissão em outras áreas que fossem previstos conhecimentos pedagógicos. Com isso nos perguntamos: Como a formação docente se caracterizará com a mudança implementada pela Resolução CNE/CP no 02/2019 do Ministério da Educação? Como resultado parcial dessa pesquisa, frisa-se o impacto profundo no campo epistemológico e político na formação de professores no Brasil.",Sim,Digital nativo,Sim,Drive disponibilizado pelo professor.,https://drive.google.com/open?id=1zH2tyAs1mTJpvJQQHyWqyoESIFYOi0T4,Karimy Manuelle da Silva Balbino.,Não publicado no repositório da UFRR.,,15/05/2026 16:59:45,Não,Form2,,2022.0,19.0,1.0,0.4529870812837999,3.0,False
42,Pedagogia,Pedagogia,PEDAGOGO NO JUDICIÁRIO: RELATO DE EXPERIÊNCIA DE ESTÁGIO DE UM PEDAGOGO NA ESCOLA DO PODER JUDICIÁRIO DE RORAIMA,,Kawanny Oliveira de Lucena,Maria Edith Romano Siems,não se aplica,NÃO INFORMADO,2022,Não informado,19,Pedagogia Jurídica. Pedagogo no Judiciário. Educação Corporativa.,Sim,"Este artigo constitui-se em um relato de experiências vividas no âmbito da Escola do Poder Judiciário de Roraima – Ejurr, sendo uma instituição de educação corporativa, mantida pelo Tribunal de Justiça do Estado. Foi desenvolvida com o propósito de planejar e executar os cursos de formação inicial, capacitação e aperfeiçoamento dos magistrados, servidores e colaboradores do Poder Judiciário. O presente artigo vem com uma proposta de mostrar a importância do pedagogo na Escola do Poder Judiciário de Roraima, apresentando um olhar diferenciado em relação à pedagogia e à atuação desse profissional. Visa apresentar a experiência de estágio extracurricular na Escola do Poder Judiciário de Roraima, assim como também conceituar e descrever as contribuições da Pedagogia Jurídica. Para isso realizou-se um levantamento de material bibliográfico, pautado na análise de artigos, livros, revistas e sites para aprofundar meus saberes no campo da Pedagogia Jurídica e da Educação Corporativa, espaços em que meu estágio está inserido, e também na minha experiência como estagiária no Tribunal de Justiça, atuando na Escola do Poder Judiciário de Roraima, especialmente, as atividades desenvolvidas no Setor de formação e Aperfeiçoamento – SFAPER, cujo objetivo é promover as ações de formação continuada de profissionais do Poder Judiciário, desenvolvendo suas atribuições conforme as diretrizes pedagógicas que regulam o funcionamento da escola.",Sim,Digital nativo,Sim,https://drive.google.com/drive/folders/1ikWM5IT1iGw9qHeIX34-JFsD-Eanr1Pn,https://drive.google.com/open?id=1PqKk9A70o787hFDE5JCvNJd1ObSLP2ow,Jelynne Ewellyn Felipe Pinto,NÃO TEM RESTRIÇÃO,,20/05/2026 09:54:36,Não,Form2,,2022.0,19.0,3.0,0.9897090148834286,2.0,False
43,Pedagogia,Pedagogia,A CONFIGURAÇÃO DOCENTE: SER PROFESSORA E LIDERANÇA EM UMA COMUNIDADE INDÍGENA DE AMAJARI - RORAIMA,,ALEXANDRINA PEREIRA DA SILVA,Gilvete de Lima Gabriel,não se aplica,não informado,2023,Não informado,37,Afetividade. Relação Professor/Aluno. Liderança. Formação Docente. Narrativas Autobiográficas.,Sim,"A presente pesquisa descreve as experiências de uma discente em pedagogia em processo de formação na UFRR, que usa seus relatos com o objetivo principal de abordar a atuação da escola diante do aluno que precisa de atenção, pensar nesse aluno como ser humano, ter um olhar de afeto e pedagógico, tendo consciência da necessidade de apoiar e orientar o discentes em sua trajetória. Trata-se de uma pesquisa qualitativa autobiográfica construída com as memórias de uma docente em formação, analisando as relações afetivas como instrumento fundamental ao professor no processo ensino-aprendizagem, refletindo sobre o contexto da afetividade que vai além do pedagógico. A narrativa que compõe este trabalho refere-se a várias situações que foram vivenciadas enquanto discente de pedagogia, que se preocupa com o aprendizado dos alunos em meio às dificuldades da profissão em uma comunidade indígena do Município de Amajari-RR. O objetivo principal desta narrativa é abordar a atuação docente mediante as dificuldades enfrentadas pelos alunos. Os resultados apresentam conflitos relacionados à socialização, agressividade, evasão escolar, queda no rendimento ou dificuldade na aprendizagem. Isso a partir de um resgate das minhas memórias, uma oportunidade de experienciar a docência ainda em processo de formação, ao realizar um trabalho com empatia aos alunos, de um jeito diferente, buscando aprimorar a prática pedagógica ao contexto escolar a realidade dos discentes.",Sim,Digital nativo,Sim,https://drive.google.com/drive/folders/1ikWM5IT1iGw9qHeIX34-JFsD-Eanr1Pn,https://drive.google.com/open?id=1ZRQNEolEWyK9uv1TpgyfxafwdFNHlvDQ,Jelynne Ewellyn Felipe Pinto,não se aplica,,20/05/2026 10:03:24,Não,Form2,,2023.0,37.0,1.0,0.5950963669438748,3.0,True
44,Pedagogia,Pedagogia,RELATO DE EXPERIÊNCIA DE ALFABETIZAÇÃO E ENSINO DE MATEMÁTICA NO PROGRAMA RESIDÊNCIA PEDAGÓGICA,,Rosélia Maria de Sousa Alexandre,Pedro Augusto Hercks Menin,Não se aplica,Não informado,2022,Não informado,19,"jogos, ludicidade, ensino de matemática, alfabetização",Sim,"Este é um relato de experiência realizado dentro do Programa Residência Pedagógica. Inicialmente, é teoricamente abordado o PIBID (Programa Institucional de Bolsas de Iniciação à Docência), Programa Residência Pedagógica, e à Base Nacional Comum Curricular (BNCC): seus conceitos, históricos e como os temas estudados estão sendo trabalhados no contexto atual. Em seguida, é apresentada a experiência da autora em duas escolas no Programa Residência Pedagógica, trabalhando com jogos na alfabetização e no ensino da matemática, em uma abordagem predominantemente remota, devido à pandemia da COVID 19, seus principais resultados em termos de melhorias na aprendizagem, e as conclusões no que se refere tanto para a aprendizagem dos alunos quando para a formação da autora como profissional da Educação.",Sim,Digital nativo,Sim,https://drive.google.com/drive/folders/1ikWM5IT1iGw9qHeIX34-JFsD-Eanr1Pn,https://drive.google.com/open?id=1ByDC5d7XdAz1e1Sz7QmJL0WHXSywEy8_,Jelynne Ewellyn Felipe Pinto,,,20/05/2026 10:11:29,Não,Form2,,2022.0,19.0,1.0,0.9864193290458184,3.0,False
