id,grupo_tcc,curso_fonte,titulo,tipo_tcc,autor,orientador,coorientador,banca_examinadora,ano_defesa,semestre_defesa,paginas,palavras_chave,resumo_disponivel,resumo,tcc_digital,formato,disponivel_integral,link,arquivo,pesquisador,observacoes_acesso,observacoes_analise,carimbo,em_ambos_forms,fonte,conflitos,ano_num,pag_num,topico_dom,topico_prob,cluster,tem_indigena
69,Insikiran,Insikiran – Ciências Sociais,"Novas Propostas Para A Educação Escolar Indígena: Fazer Caxiri Com Os Alunos Do 1o Ao 3o Ano Do Ensino Médio Da Comunidade Indígena Maturuca, Uiramutã - RR",,JULIETA ESTEVÃO DA SILVA CORRÊA,Maxim Repetto Carreno,Não se aplica,Não informado,2022,2º semestre,61,Atividades Sociais; Educação indígena; Método Indutivo Intercultural;Teoria da Atividade.,Sim,"Esta pesquisa teve como objetivo elaborar propostas pedagógicas tendo como base o Método Indutivo Intercultural e a Teoria da Atividade. Para isso elaboramos uma proposta baseada na atividade social de fazer o caxiri com os alunos do ensino médio do 1o a 3o ano, abordando o estudo intercultural através dos conhecimentos escolares e dos saberes ou conhecimentos indígenas. A atividade educativa foi realizada na Escola Estadual Indígena José Alamano, na comunidade indígena Maturuca, na Terra Indígena Raposa Serra do Sol, no município de Uiramutã, estado de Roraima. A pesquisa teve como base o calendário socionatural da comunidade, ponto de partida para desenvolver estudos sobre as práticas culturais, relação da escola com as atividades da comunidade e a relação da sociedade com a natureza. Os resultados alcançados mostram que é importante que a escola mantenha uma relação com as atividades existes na comunidade, relacionando pesquisas educativas com as atividades sociais e outras formas educativas existentes nas próprias comunidades indígenas. De forma que possamos valorizar a cultura, os costumes, as tradições e as crenças. Tudo isso deve ser trabalhado não só com alunos mais velhos, mas também nos ensinos iniciais, pois além de ser um método que ajuda na proposta pedagógica da escola indígena, contribui na formação do professor (a), pesquisador(a) e do estudante na comunidade.",Sim,Digital nativo,Sim,https://drive.google.com/file/d/1TjzqKPAPowFD5dQ-ahCc7JaowcVypcom/view?usp=drive_link,https://drive.google.com/open?id=1QIIv7a0PU9lqhlPwZdryxy0Gj1yPjEpV,Elcio Leocádio da Silva Júnior,,,22/05/2026 18:49:48,Não,Form2,,2022.0,61.0,2.0,0.931353881074747,0.0,True
70,Insikiran,Insikiran – Ciências Sociais,"EDUCAÇÃO PATRIMONIAL, CULTURA MATERIAL E ARTESANATO NO JATAPUZINHO",,ROSE AFONSO MAFORE WAI WAI,Fabíola Christian Almeida de Carvalho,Não se aplica,Profa Dra. Fabíola Christian Almeida de Carvalho Orientadora / Curso de Licenciatura Intercultural – UFRR/Presidente Prof.a Mestre Dayana Soares Araújo Paes Membro/ Departamento de Artes Visuais – UFRRMembro Prof. Dr. Fernando José Ciello Membro/Departamento de Antropologia/INAN – UFRR/Membro Prof. Dr. João Paulo Roberti Junior Membro/ Departamento de Psicologia/CEDUC – UFRR/Membro,2022,Não informado,64,"Arte indígena, Wai Wai, Roraima, Educação Patrimonial.",Sim,"Os Wai Wai do Jatapuzinho ainda produzem muitos trançados a partir das matérias primas das matas. Esses trançados são conhecimentos vivos que ainda estão presentes no dia a dia da comunidade, mas que as novas gerações já não praticam em seu cotidiano. Por isso é importante que a escola valorize esse vasto conhecimento cultural por meio da educação patrimonial. O trabalho apresenta o artesanato Wai Wai produzido na comunidade indígena Jatapuzinho e foi realizado na escola local com o objetivo de discutir educação patrimonial e a importância do artesanato nas aulas de Ciências Sociais na Escola Estadual Indígena Wai Wai, Terra Indígena Trombetas Mapuera em Roraima. Como método de pesquisa foram realizadas várias entrevistas com as pessoas que têm mais experiência sobre o artesanato do Jatapuzinho, leitura da bibliografia sobre artes índias, aulas de campo para fotografar o artesanato local e os processos envolvidos na confecção das peças. Professores, alunos e a comunidade participaram da pesquisa de forma colaborativa. Como resultado do trabalho, foram catalogadas as oito iconografias mais utilizadas nos artesanatos locais (paxki yemeknu, akri yorî, osohku yari, akîhtoxapu Xapari kacho, kahxapu mewru poroto, pororî kirpapa, kahxapu mewru e poroto matkiri). E os principais artesanatos feitos por homens (Kwahsî/ Tipiti, Uwi Yimyapotopo/Peneira de farinha, Wayapamsî/Abano, Awci/Jamaxim, Reere/Banco, Krapa/Arco, Wayamakasî/Pente e Weeci/Mesa de arumã) e mulheres (Tahrem/Panela de barro, Xkmari/Ralo Keweyu/Tanga, Emehknumi/Pulseira, Katami/Cinto, Kwarî/Colar, Panatarî/Brinco e Apomi/Bracelete) da comunidade, os recursos da biodiversidade utilizados na confecção deles e modo de fazer cada artesanato são apresentados. Como principal conclusão do trabalho aprendemos que é importante discutir a valorização do saber e do saber fazer, ficando demonstrado que tanto os jovens quanto os idosos entendem que é importante a manutenção da cultura material presente em seus artesanatos.",Sim,Digital nativo,Sim,https://drive.google.com/file/d/1CZHWLnwpIXNuCCwuJO_XohknQeJlfdqu/view?usp=drive_link,https://drive.google.com/open?id=1TzlBRWrolIdoqATEEqoV_J8bM3z_9ea7,Elcio Leocádio da Silva Júnior,,,22/05/2026 18:59:05,Não,Form2,,2022.0,64.0,2.0,0.991436076427978,0.0,True
71,Insikiran,Insikiran – Ciências Sociais,PROPOSTA PEDAGÓGICA COLHER MILHO NA ROÇA: atividade social indígena como proposta de intervenção pedagógica no ensino/aprendizagem dos desafios da Escola Estadual Indígena Jose Antônio de Souza,,VALTERLIS SOUZA DE SOUZA,Maxim Repetto Carreno,Não se apliva,Não informado,2022,Não informado,97,"PALAVRAS-CHAVE: colher milho na roça, educação escolar indígena, teoria da atividade.",Sim,"Esta pesquisa teve como tema a “PROPOSTA PEDAGÓGICA COLHER MILHO NA ROÇA: Prática cultural indígena como proposta de intervenção pedagógica no ensino/ aprendizagem dos desafios da Escola Estadual Indígena José Antônio de Souza. Sendo esta, um estímulo para a intervenção do ensino das comunidades indígenas, pois é preciso que os alunos conheçam e valorizem a cultura dos seus ancestrais de maneira tal que estes estejam associados as atividades escolares. Diante dessa temática, surgiu o questionamento de qual a importância das atividades culturais associadas às propostas pedagógicas no processo de ensino e aprendizagem, e de quais os desafios enfrentados na Escola Estadual Indígena José Antônio de Souza? Com o intuito de responder este questionamento, como objetivo geral, esboçamos desenvolver a proposta pedagógica de colher milho na roça, seguindo o calendário socionatural, para proporcionar uma determinada aprendizagem aos alunos do 6o ao 9o ano do Ensino Fundamental; como objetivos específicos propusemos conhecer a realidade da escola onde a proposta seria desenvolvida; discutir os problemas pedagógicos vivenciados por estas escolas indígenas durante o período da pandemia e desenvolver uma proposta pedagógica na escola, que envolvesse os alunos e a comunidade, a fim de proporcionar uma aprendizagem significativa à estes alunos a respeito da cultura na qual estão inseridos. A metodologia de pesquisa utilizada foi de cunho bibliográfico através da análise do método indutivo. Esta pesquisa proporcionou atividades que foram realizadas na escola em parceria com a comunidade, onde foi possível perceber que os alunos que participaram de atividades diferenciadas, em conjunto com a comunidade, como na colheita do milho, tiveram a oportunidade de aprender diferentes conteúdos mediante discussões de quantidade, qualidade, tempo de serviço, lucro, tipo de solo, produção de desenhos, produção de textos em sala de aula, de acordo com o que haviam vivenciado nos dias da realização da prática proposta. Pois a atividade propiciou momentos de interação entre a comunidade e os alunos, por intermédio da troca de novos saberes culturais, entre eles e os seus ancestrais, por meio de conversas orais, com narrativas de históricas, resgatando e valorizando a cultura dos povos originários. Portanto, a educação indígena diferenciada contribuiu para os alunos aprenderem o conteúdo da proposta curricular sugerida, assim como de valorizar a cultura indígena com a intervenção da troca de saberes entre comunidade indígena e escola com base na prática pedagógica desenvolvida na escola com o apoio da comunidade.",Sim,Digital nativo,Sim,https://drive.google.com/file/d/125SBh3HYCJXQXVMdvgaxzV_OhTFTFqu7/view?usp=drive_link,https://drive.google.com/open?id=1696lwzyWD9wwX50zUrTBlTzlMA9yieQJ,Elcio Leocádio da Silva Júnior,,,22/05/2026 19:06:15,Não,Form2,,2022.0,97.0,2.0,0.995379093537352,0.0,True
72,Insikiran,Insikiran – Ciências Sociais,EDUCAÇÃO PATRIMONIAL NA COMUNIDADE BARRO / SURUMU – TERRA INDÍGENA RAPOSA SERRA DO SOL,,LUCIANO PERES BONIFÁCIO FILHO,Jonildo Viana dos Santos,Não se aplica,Prof. Dr. Jonildo Viana dos Santos Orientador/Curso de Licenciatura Intercultural – Instituto Insikiran/UFRR Profa. Dra. Iana dos Santos Vasconcelos Curso de Licenciatura Intercultural – Instituto Insikiran/UFRR Profa. Me. Danielle da Silva Trindade Curso de Licenciatura Intercultural – Instituto Insikiran/UFRR,2022,Não informado,75,Educação; Patrimônio; Identidade Cultural.,Sim,"Este trabalho tem como objetivo apresentar alguns aspectos da relação estabelecida entre Patrimônio Histórico Cultural e a Educação Escolar Indígena, baseando-se no conhecimento e observação de alunos e professores da Escola Estadual Indígena Tuxaua Silvestre Messias. E também visa mostrar como a temática patrimonial é tratada no processo educacional, como prática preservacionista do Patrimônio Cultural e como proposta de inserção na disciplina de História, como um tema transversal. Partindo do pressuposto de que as escolas indígenas dispõem de uma educação diferenciada, fruto de conquista dos povos indígenas e reconhecida pela Constituição de 1988, observa-se o papel determinante que a escola indígena pode desenvolver como forma de apropriação, preservação e valorização de sua identidade cultural.",Sim,Digital nativo,Sim,https://drive.google.com/file/d/1fw_O5TclJa6x0gmHYPUJAS-ykDxsIa6z/view?usp=sharing,https://drive.google.com/open?id=1kNpPIJZvD9UqeKPqURhCZl34-cyNJmez,Elcio Leocádio da Silva Júnior,,,22/05/2026 19:11:43,Não,Form2,,2022.0,75.0,2.0,0.8758116652764608,0.0,True
73,Insikiran,Insikiran – Ciências da Natureza,A MATEMÁTICA NOS ARTESANATOS DA COMUNIDADE MARUPÁ,,EVILENE DA SILVA,Michael Lopes da Silva Rolim,Não se aplica,Prof. Dr. Michael Lopes da Silva Rolim (Orientador/Licenciatura intercultural - UFRR) Prof. Me. Danielle da Silva Trindade (Membro/Licenciatura Intercultural - UFRR) Prof. Me. Mariana Souza da Cunha (Membro/Licenciatura Intercultural - UFRR),2023,Não informado,38,Etnomatemática; Artesanatos; Comunidade Marupá.,Sim,"Apresenta os resultados da pesquisa realizada durante os estágios curriculares supervisionados, do Curso de Licenciatura Intercultural, da Universidade Federal de Roraima. O principal objetivo foi identificar como os conhecimentos matemáticos são utilizados pelos artesãos da Comunidade Marupá, na confecção dos artesanatos feitos com a fibra de buritizeiro (Mauritia flexuosa) e de arumã (Ischnosiphon arouma) e, elaborar práticas pedagógicas que incluam, de maneira objetiva, esses conhecimentos no currículo escolar, de modo a contribuir para melhor compreensão dos conceitos matemáticos e valorização da cultura local. O estudo foi desenvolvido por meio de revisão bibliográfica e atividades fundamentadas na Pesquisa Ação, por meio da realização de oficinas de artesanato, com estudantes do Ensino Fundamental II, da Escola Estadual Indígena Tuxaua Pedro Terêncio.",Sim,Digital nativo,Sim,https://drive.google.com/file/d/1XhoggK63-fNfO5Jz2RMjky0go94Cb26q/view?usp=sharing,https://drive.google.com/open?id=1rcJ4Y4sUPPIEPycGxvwdGF3tTTo5L6td,Jelynne Ewellyn Felipe Pinto,,,23/05/2026 12:39:49,Não,Form2,,2023.0,38.0,2.0,0.9850737130949352,0.0,True
74,Insikiran,Insikiran – Ciências da Natureza,ALIMENTAÇÃO TRADICIONAL INDÍGENA NA COMUNIDADE ANTA II COMO FORMA DE VALORIZAÇÃO DA CULTURA E IDENTIDADE,,MARIZA DE ALBUQUERQUE MIRANDA,Mariana Souza da Cunha,Não se aplica,Prof.ª Msc. Mariana Souza da Cunha (Orientadora) Prof.ª Iana Vasconcelos (Membro / Licenciatura Intercultural) Prof.ª Me. Ana Paula Alves (Membro / Gestão em Saúde Coletiva Indígena),2023,Não informado,37,Alimentação tradicional. Educação indígena. Cultura. Identidade. Ciências da Natureza.,Sim,"O presente trabalho tem por finalidade mostrar a importância de conhecer e consumir os produtos tradicionais encontrados na base alimentar tradicional no convívio dos povos indígenas da comunidade anta II, bem como orientar o consumo adequado a nossa saúde e bem estar como forma de prevenção a sua cultura e identidade dentro da sociedade. Que através dos alimentos tradicionais possamos ter numa qualidade de vida alem de preservar a cultura local e os conhecimento próprio que ao diagnosticar a falta de consumo alimentar tradicional no dia dia das pessoas da comunidade. Foram realizadas entrevistas com os moradores da comunidade e também foi feita uma mostra de alguns alimentos que trazem beneficio a saúde ao meio ambiente, foram feitas algumas pesquisa na residência de algumas famílias e podemos constatar que muitos alimentos não são retirados diretamente da natureza para serem consumidos, são alimentos industrializados, .que causam grandes impactos a saúde da nossa comunidade. No geral esse trabalho foi importante para mostrar os tipos de alimento que ainda são da cultura indígena e que precisam ser preservados como forma de manter a saúde alimentar do nosso povo. Além de chamar a atenção para perda de muitos alimentos que deixaram de ser consumidos na comunidade.",Sim,Digital nativo,Sim,https://drive.google.com/file/d/1wx37wMGPxUFMXdZP-UjBQua5M9P7hlJx/view?usp=sharing,https://drive.google.com/open?id=1DpyIefDibqidib1m1iH1uSejhSY0DKfe,Jelynne Ewellyn Felipe Pinto,,,23/05/2026 13:23:20,Não,Form2,,2023.0,37.0,2.0,0.9913040201224236,0.0,True
75,Insikiran,Insikiran – Ciências da Natureza,"ARTESANATO E ETNOMÁTICA NA ESCOLA DO ANAUÁ, TERRA INDÍGENA WAI WAI - RORAIMA",,XARATEW WAI WAI,Fábio Almeida de Carvalho,Não se aplica,Prof. Dr.ª Fabíola C. Almeida de Carvalho Prof. Dr. Fernando José Ciello Prof. Dr.ª Hanna Cibelle Lins Rocha Limulja,2023,Não informado,48,Não tem,Sim,"A ideia de construir uma Proposta Pedagógica para ensinar etnomatemática a partir dos conhecimentos sobre o artesanato produzido na comunidade indígena Anauá, Terra Indígena Anauá, surgiu com a finalidade de refletir com os jovens a importância da cultura e das técnicas utilizadas na confecção dos artesanatos locais e de construir metodologias de ensino mais conectadas com a realidade local. Já era uma demanda da comunidade que a escola trabalhasse com materiais concretos locais e o tema artesanato indígena com o arumã e as suas fibras gera possibilidades metodológicas do aluno aprender a fazer o artesanato e ao mesmo tempo aprende a matemática no seu dia a dia. O objetivo da pesquisa foi construir uma Proposta Pedagógica para o ensino da etnomatemática para alunos do 6o ano do ensino fundamental a partir do artesanato produzido com arumã na comunidade indígena Anauá. No projeto buscamos construir a visão de que o artesanato não é só mexer com tranças, mais se inspirar no mundo contemporâneo, na escrita, na leitura, nos desenhos e na matemática. Realizamos oficinas na escola com tema “Artesanatos indígenas feitos com arumã e as suas fibras”, em que confeccionamos peças de peneira simples, peneira de farinha, tipiti e jamaxim, como via para a construção de um método de ensino de etnomatemática que possibilitasse aos alunos aprender a fazer o artesanato e, ao mesmo tempo, aprende a matemática presente no seu dia a dia. E nas aulas de matemática por meio da produção do artesanato local desenvolvemos problemas para ensinar os conteúdos das quatro operações fundamentais da matemática e formas geométricas. Os alunos que tinham dificuldade nas quatros operações fundamentais da matemática aprenderam mais com essa metodologia.",Sim,Digital nativo,Sim,https://drive.google.com/file/d/1U8y6BQ1aThrHJxUwk3tq3jUD0s0rDX0U/view?usp=sharing,https://drive.google.com/open?id=1pleGHwuy5KwjOu59SWeSCcZFnjakfEwd,Jelynne Ewellyn Felipe Pinto,,,23/05/2026 13:34:17,Não,Form2,,2023.0,48.0,2.0,0.9717120894448537,0.0,True
76,Insikiran,Insikiran – Ciências da Natureza,"CATALOGAÇÃO DOS PEIXES NA COMUNIDADE MANALAI EM RORAIMA,VALORIZANDO A CULTURA DO POVO INGARICÓ",,CARLOS OLIVEIRA NICÁCIO,Mariana Cunha,Não se aplica,Mariana Souza da Cunha (Presidente): Vinculada à Licenciatura Intercultural da Universidade Federal de Roraima. Michael Lopes da Silva Rolim (Membro): Vinculado à Licenciatura Intercultural da Universidade Federal de Roraima Ise de Goreth Silva (Membro): Vinculada à Gestão Territorial Indígena da Universidade Federal de Roraima,2023,Não informado,40,Educação indígena; Cultura; Peixe; Recursos naturais.,Sim,"Sabe se que hoje passou-se a ter uma preocupação com o meio ambiente, com isso não tem sido diferente quanto a criação e cultivo de peixes, pois já ouvia falar que de onde só é retirado e não se repõem, a tendencia é que se acabe quando mais olhando para o fator histórico da pesca em Roraima. É necessário cuidar dessa reprodução de peixes para que não se acabe. Durante a realização do estágio, elaborou-se a proposta de catalogar as espécies de peixes na comunidade manalai, como forma de valorização da cultura e identidade do povo ingaricó. Metodologicamente, está pesquisa constituem-se em um conjunto de métodos e procedimentos, organizados em etapas, que facilitarão a elaboração de um trabalho científico bem fundamentado e capaz de esclarecer as ocorrências da realidade. Apresentou os seguintes resultados onde os objetivos foram alcançados, sendo eles: identificar a variedade de espécies de peixes na comunidade e região na língua ingaricó; descrever as formas de uso das diferentes espécies, se medicinal, alimentícia e cultural; confeccionar cartazes, banner sobre os tipos de peixes da comunidade. Diante disso, essa trabalho foi importante para conhecer e buscar alternativa de valorizar os recursos naturais, neste caso a variedade de peixes ainda encontrados na comunidade.",Sim,Digital nativo,Sim,https://drive.google.com/file/d/1OHpS8njd0EjVc3DD0ZPA5ONHAh6etLIr/view?usp=sharing,https://drive.google.com/open?id=1wS1XafC5KtYefZK78atqMDzJoQqXsnJd,Jelynne Ewellyn Felipe Pinto,,,23/05/2026 14:03:22,Não,Form2,,2023.0,40.0,2.0,0.9887131001942968,0.0,True
77,Insikiran,Insikiran – Ciências da Natureza,FIGURAS GEOMÉTRICAS NO ENSINO DA MATEMÁTICA PARA A 1a SÉRIE DO ENSINO MÉDIO DA ESCOLA ESTADUAL INDÍGENA BERNARDO SAYÃO DA COMUNIDADE MARACANÃ I,,POLIANA DE SOUZA ESBELL,Mariana Souza da Cunha,Não se aplica,Profª Me. Mariana Souza da Cunh Prof. Dr. Michael Lopes da Silva Rolim Profª Me Raquel Cristina Demétrio Magalhaes,2023,Não informado,34,Educação Indígena. Ensino de matemática. Material didático. Artesanato,Sim,"A educação indígena vem sendo um desafio a ser vencido por todos que trabalham nesse âmbito, pois as dificuldades são imensas e tão pouco a sociedade tem dado importância ou buscado uma melhor maneira de ajudar nesse descaso que vem ocorrendo na educação indígena. O ensino de matemática ainda é considerado por muitos de difícil entendimento e compreensão, pois pouco se valoriza os conhecimentos tradicionais, empíricos que os alunos tem, por isso tem-se buscado meios de ajudar aos alunos a entender e compreender melhor o ensino e assim a superar as dificuldades encontradas ao logo da jornada escolar e no cotidiano. O material didático não tem suprido com as necessidades dos alunos, pois cada aluno tem suas dificuldades específicas, para tanto foi necessário a construção de materiais de apoio para o ensino de matemática, pois os materiais didáticos que são enviados para as escolas não condizem com a realidade que existe nas comunidades indígenas. O artesanato indígena é muito presente no ensino da matemática, uma vez que o aluno aprende praticando, de modo que cada aluno tem melhor entendimento e seu desenvolvimento é visivelmente melhor, o uso de produtos que a natureza proporciona é muito eficaz, a fibra de arumã, a jacitara, entre outras, além de ajudar no ensino da matemática, ainda ajuda na cultura dos povos indígenas, assim estimulando o uso de recursos naturais que existem dentro de nossa comunidade.",Sim,Digital nativo,Sim,https://drive.google.com/file/d/1CDQaCXG6zQrQQ1vQ3tBO8xDv0w__iJ5R/view?usp=sharing,https://drive.google.com/open?id=1DdJUj5wRpgwlg2LxQ0yXDEZk_Cji1sou,Jelynne Ewellyn Felipe Pinto,,,23/05/2026 14:14:15,Não,Form2,,2023.0,34.0,2.0,0.9911706937507268,0.0,True
78,Insikiran,Insikiran – Ciências da Natureza,"HISTÓRIAS EM QUADRINHOS COMO RECURSO PARA ENSINO DE MATEMÁTICA NO CONTEXTO INDÍGENA NA ESCOLA ESTADUAL INDÍGENA TOBIAS BARRETO, COMUNIDADE MANGUEIRA, AMAJARI-RR",,TATIANNY GOMES LUCENA,Ricardo Carvalho dos Santos,Não se aplica,Prof. Dr. Ricardo Carvalho dos Santos Prof. Dr. Michael Lopes da Silva Rolim Profa. MSc. Virginia Marne da Silva Araújo dos Santos,2023,Não informado,32,"Histórias em quadrinhos, quatro operações matemáticas,contexto indígena.",Sim,"As histórias em quadrinhos (HQs) têm sido utilizadas pela população mundial há muito tempo por diversas faixas etárias, em grande parte de seu uso é o entretenimento, porém observou-se que existia a possibilidade de seu uso no ensino, como uma ferramenta de ensino e aprendizagem. Desta forma, o objetivo principal deste trabalho é o de promover o ensino das quatro operações matemáticas através do uso de histórias em quadrinhos desenvolvidas com o contexto indígena a alunos do 6o ao 9o ano do Ensino Fundamental II da Escola Estadual Indígena Tobias Barreto, Comunidade Mangueira, Amajari-RR. Essas HQs foram desenvolvidas manualmente com materiais de baixo custo e de uso comum na escola e no contexto indígena da região. Foram realizadas aulas sobre as quatro operações matemáticas, aplicados exercícios e em seguida apresentadas as revistas em quadrinhos (HQs), sabendo que esse recurso proporciona melhorias na qualidade do ensino da matemática, como operações aritméticas, algébricas e questões lógicas, consequentemente, promoveu a leitura e produção escrita, como também o pensamento lógico-matemático.",Sim,Digital nativo,Sim,https://drive.google.com/file/d/1wLYcNo5TutJIAphr7Tecd4kdJiBYhAgv/view?usp=sharing,https://drive.google.com/open?id=15YvUynwiSCMTy6zFfwh-36V6-NiJemBH,Jelynne Ewellyn Felipe Pinto,,,23/05/2026 14:23:55,Não,Form2,,2023.0,32.0,2.0,0.8779048813851109,0.0,True
