id,grupo_tcc,curso_fonte,titulo,tipo_tcc,autor,orientador,coorientador,banca_examinadora,ano_defesa,semestre_defesa,paginas,palavras_chave,resumo_disponivel,resumo,tcc_digital,formato,disponivel_integral,link,arquivo,pesquisador,observacoes_acesso,observacoes_analise,carimbo,em_ambos_forms,fonte,conflitos,ano_num,pag_num,topico_dom,topico_prob,cluster,tem_indigena
107,Insikiran,Insikiran – Ciências da Natureza,USO E DIVERSIDADE DE PIMENTAS ARDOSAS NACOMUNIDADE ALTO ARRAIA: TRAÇANDO NOVOS CAMINHOS INTERCULTURAIS,,ROBINEIDE DA SILVA SANTIAGO,Mariana Cunha,Não se aplica,Não Informado,2022,Não informado,31,Educação indígena. Conhecimento Tradicional. Pimentas. Recursos Naturais. Diversidade.,Sim,"Devido à abundância dos vários tipos de pimentas no Estado de Roraima e as poucas pesquisas direcionadas para análises das mesmas, a presente pesquisa tem como objetivo principal catalogar as formas de uso cultural, medicinal e alimentar de pimentas ardosas na Escola Estadual Indígena Vovô Leonardo Gomes e Comunidade Indígena de Alto Arráia, Região Serra da Lua, Bonfim/RR. A metodologia utilizada nesta pesquisa foi de início à bibliográfica, tendo como base autores como Barbosa, Carvalho, Lopes, Reifschneider, dentre outros, seguida pela pesquisa-ação. Para alcançar os objetivos gerais e específicos foi utilizado um questionário como instrumento, constituído por uma ordem de perguntas respondidas por escrito sem a presença do entrevistador, de forma clara e objetiva, evitando erros de interpretação. Esse questionário teve como apoio três projetos pedagógicos: projeto do viveiro escolar; projeto de catalogação dos nomes científicos e nomes wapichanas das pimentas e; projeto da mine feira de produtos agrícolas. O trabalho consta dividido em três partes: 1ª) contempla a pesquisa bibliográfica, expõe a importância e o uso das pimentas ardentes no Brasil, na Amazônia e no Estado de Roraima e mostra o Gênero Capsicum, como a pimenta mais conhecida nas comunidades indígenas do Estado de Roraima; 2ª) utilizando a pesquisa-ação, mostram as atividades desenvolvidas durante a pesquisa de campo para alcaçar os objetivos geral e específico do trabalhoe 3ª) mostra o resultado da pesquisa. Toda essa proposta de estudo contribuiu de forma ativa na construção do conhecimento científico e popular, bem como, atribuiu valores ao conhecimento tradicional dos povos indígenas.",Sim,Digital nativo,Sim,Arquivo Fornecido pelo Professor,https://drive.google.com/open?id=1EXX5flK0f1pqsV3wMwPWZAkVHyfSE5Xy,Bianca de Jesus Ramos,,,28/05/2026 18:01:46,Não,Form2,,2022.0,31.0,2.0,0.9917040945033132,0.0,True
108,Música,Música,A COLABORAÇÃO PIANÍSTICA NO CORO DA IGREJA BATISTA REGULAR DE BOA VISTA: COMPETÊNCIAS EXERCIDAS NO DIA A DIA,,LUIZ ANDRADE DE SOUZA FILHO,Rafael Ricardo Friesen,Não se aplica,Gustavo Frosi Benetti Luciano de Freitas Camargo,2019,Não informado,59,"colaboração pianística, competências, música coral",Sim,"Esta pesquisa surgiu do interesse em aprofundar os conhecimentos na área de colaboração pianística. Dessa forma, teve-se como objetivo verificar quais as competências exercidas por este profissional e quais aspectos relacionados com o Núcleo Coral podem ser observados. Foi realizado um estudo de caso com o pianista do coro da Igreja Batista Regular de Boa Vista. Utilizou-se como referencial teórico o trabalho de Friesen (2018) e de Paiva (2008), pois buscou-se verificar as correlações entre a prática do pianista investigado e os dados levantados por estas pesquisas. A metodologia adotada consistiu em observações da atuação desse instrumentista nessa instituição religiosa e uma entrevista semiestruturada seguida de análise dos dados e considerações. Para a revisão de literatura, foram buscadas publicações nacionais que possuam similaridades com o assunto abordado. Verificou-se que houve uma certa discrepância nas demandas das competências exercidas pelo instrumentista da instituição deste estudo com as levantadas por Friesen (2018).",Sim,Digital nativo,Sim,Drive disponibilizado pelo professor,https://drive.google.com/open?id=1sj3wyVDDwisdlQIDpeOvu00EVunP6yH3,Karimy Manuelle da Silva Balbino,"Disponível em outros repositórios e revistas, menos no repositório da própria Universidade.",,29/05/2026 14:42:34,Não,Form2,,2019.0,59.0,1.0,0.9861108318523072,3.0,False
109,Música,Música,MÚSICA INDÍGENA PARA FLAUTA DOCE: POSSIBILIDADES DIDÁTICAS COM MUSICALIDADES DE QUATRO ESTILOS RORAIMENSES,,ELIEL BERGUE VALENTE,Rafael Branquinho Abdala Norberto,Não se aplica,Prof.a Dra. Katiusca Lamara dos Santos Barbosa Prof. Me. Áquilas Torres de Oliveira,2022,Não informado,66,Musicalidades indígenas roraimenses. Possibilidades didáticas. Flauta doce. Educação Musical. Etnomusicologia,Sim,"O objetivo desta pesquisa é apresentar possibilidades didáticas como alternativas para o ensino da prática musical coletiva do instrumento flauta doce a partir da transcrição, adaptação e composição de arranjos inspirados em músicas indígenas transcritas de fontes orais. Dessa forma, o universo foi voltado ao olhar e à escuta da música indígena de Roraima, mais especificamente de quatro estilos musicais presentes no estado, o Areruia, o Parixara, o Takui e o Marapá. Quanto à metodologia, a pesquisa trabalhou com abordagens qualitativas inspiradas no método da etnografia por meio da realização de entrevistas abertas com a professora e o professor indígenas da etnia Macuxi, Lavina Pereira Xavier e Marcílio Curicaca, bem como das experiências intersubjetivas enquanto professor de música entre indígenas da mesma etnia nas comunidades Campo Alegre e Vista Alegre entre os anos de 2009 e 2011. Além disso, a pesquisa bibliográfica e o referencial teórico nos campos da Etnomusicologia, da Antropologia e da Educação Musical foram determinantes para a construção das bases conceituais desta monografia. As histórias de vida cedidas por meus colaboradores e seus anseios para a educação reforçam a justificativa desta pesquisa. Pretendo, também, homenagear as culturas indígenas de Roraima observando seus aspectos gerais em diálogo com as pesquisas musicológicas de Devair Antonio Fiorotti e Terêncio Luiz Silva (2018), uma vez que o autor reconhece que a obra musical indígena é composta por um universo imenso de características e possibilidades. Ainda, apresento os quatro estilos em questão com a finalidade de compreendê-los por intermédio da ampliação de seus aspectos históricos e musicais, embasado, para além das entrevistas e das pesquisas de Fiorotti e Silva, nas reflexões etnomusicológicas de Tiago de Oliveira Pinto (2001); de Bastião (2012), com a prática coletiva de instrumentos; de Noara de Oliveira Paoliello (2007), com a dupla função da flauta doce; e de Paul Zumthor (1997), com a poesia oral e seu potencial de transmissão. Por fim, publicizo algumas partituras contendo composições e arranjos - de minha autoria - para flauta doce e percussão, com o objetivo de contribuir para a educação musical local/regional mediante o diálogo com as musicalidades indígenas e de fomentar a prática musical indígena dentro e fora da sala de aula, ampliando sua disseminação para fora do ambiente das comunidades. Como contribuições desta pesquisa, espero que este seja um referencial inicial para o desenvolvimento de atividades didáticas e musicais no contexto da Educação Musical Infantil e da prática musical em conjunto a partir de obras inspiradas em musicalidades indígenas do estado de Roraima.",Sim,Digital nativo,Sim,Drive disponibilizado pelo professor,https://drive.google.com/open?id=1LHzjpqCTqPxMQ1KPlKkwVXtZ9Ue9p3Za,Karimy Manuelle da Silva Balbino,Não há localização,,29/05/2026 14:48:22,Não,Form2,,2022.0,66.0,1.0,0.6420259634870873,3.0,True
110,Pedagogia,Pedagogia,"O TRABALHO DO PEDAGOGO HOSPITALAR: UMA EXPERIÊNCIA NO HOSPITAL DA CRIANÇA SANTO ANTONIO, EM BOA VISTA-RR",,KEILA TEIXEIRA DE SOUZA,Pedro Augusto Hercks Menin,Não se aplica,Não informado,2019,Não informado,26,Humanização; Pedagogia Hospitalar; Formação do pedagogo; Equipe multidisciplinar,Sim,"O presente trabalho visa apresentar, dentre os muitos espaços não-formais de atuação do pedagogo, o hospital, que aparece como sendo um local que requer de profissionais advindos de outras áreas, como por exemplo, educação, a integração em um trabalho de humanização no atendimento aos pacientes. É pensando nisso que surge a seguinte problemática: qual é o trabalho do pedagogo hospitalar? Neste sentido, o objetivo geral deste artigo é compreender qual é o papel do pedagogo no hospital, e os objetivos específicos são: verificar quais são as responsabilidades da pedagogia hospitalar com os alunos e pais; identificar as atividades desenvolvidas no ambiente hospitalar; descrever sobre o trabalho do pedagogo hospitalar no processo de recuperação e readaptação dos alunos. Para tanto, utilizará de um relato de experiência de estágio, realizado no Hospital de Criança Santo Antônio, localizado em Boa Vista-RR. Os relatos da então estagiária e autora deste texto demonstram como se efetiva o trabalho do pedagogo no hospital, desde o planejamento de aula até adentrar na classe hospitalar.",Sim,Digital nativo,Sim,Link do Drive,https://drive.google.com/open?id=17Fv3nlC1ZNtTlXDsXhSRbGgAJiOHUuSl,Laíne Pereira Fernandes,,,29/05/2026 19:13:23,Não,Form2,,2019.0,26.0,3.0,0.9881590318543552,3.0,False
111,Pedagogia,Pedagogia,EDUCAÇÃO DE JOVENS E ADULTOS NO BRASIL: PANORAMA SOBRE FUNCIONAMENTO E ORGANIZAÇÃO NO TRIÊNIO DE 2016-2018 E SUGESTÕES AO APRIMORAMENTO DO PROGRAMA,,Leciane Borges Silva,Sebastião Monteiro Oliveira,Não se aplica,Não informado,2019,1º semestre,19,Educação de Jovens e Adultos; Trabalhadores; Estudantes,Sim,"O presente trabalho de pesquisa discorreu acerca do funcionamento e organização da educação de jovens e adultos no Brasil nos dias atuais, tendo, como objetivo geral, a compreensão de tal modalidade de ensino no Brasil, abordando as peculiaridades dos ensinos noturnos e a sua sistemática educacional, bem como as diversas formas de ensino do regular e da Educação de Jovens e Adultos. Para tanto, como metodologia científica adotou-se a pesquisa exploratória e bibliográfica, feita a partir do levantamento de referências teóricas já analisadas e publicadas por meios escritos e eletrônicos, como livros, artigos científicos, e web sites. Com a realização do trabalho, foi constatada que boa parcela das causas do fracasso escolar de grande parte dos estudantes, principalmente dos que voltam a frequentar a escola depois de anos de afastamento, reside no fato de eles terem uma educação descontextualizada e sem significado algum dentro da realidade que vivenciam diariamente, ratificando-se também que, somente por meio da educação e da conscientização do aluno como cidadão responsável e com direitos",Sim,Digital nativo,Sim,Link do Drive,https://drive.google.com/open?id=1KmUxENrtwWdG-CZj5kNPEcDC1aJ6LUqo,Laíne Pereira Fernandes,,,29/05/2026 19:30:38,Não,Form2,,2019.0,19.0,1.0,0.9865193219038798,3.0,False
112,Pedagogia,Pedagogia,PEDAGOGIA HOSPITALAR: CLASSE HOSPITALAR NAS UNIDADES PÚBLICAS DE SAÚDE DE ALTA COMPLEXIDADE EM UM MUNICÍPIO DA REGIÃO NORTE DO BRASIL,,MICHELE DOS SANTOS CAVALCANTE,Maria Edith Romano Siems,Não se aplica,Prof.ª Dr.ª Maria Edith Romano Siems Marcondes (Orientadora/ Curso de Pedagogia - UFRR) Profª. Ma. Elizangela da Silva Barboza Ramos (Avaliadora/Curso de Pedagogia - UFRR) Prof. Dr. Sebastião Monteiro Oliveira (Avaliador/ Curso de Pedagogia - UFRR),2019,1º semestre,33,Pedagogia Hospitalar; Classe Hospitalar; Educação Especial; Contexto não-escolar; Atendimento Educacional Especializado,Sim,"A presente pesquisa procurou verificar as condições de oferta de acompanhamento educacional para crianças e jovens que se encontram em longo período de internação hospitalar, nos hospitais públicos de alta complexidade de um município localizado na região norte do Brasil. Para tanto, buscamos identificar como ocorrem as ações pedagógicas no âmbito hospitalar, quais metodologias de ensino são utilizadas pelos pedagogos, verificar também se estas instituições de saúde estão preparadas ou tem espaço destinado para realizar a mediação deste processo de atendimento educacional. Para fundamentarmos este trabalho que tem enfoque no campo das investigações qualitativas e base nas pesquisas exploratórias, foi necessário aprofundarmos nossos estudos sobre os documentos legais como as leis e estatutos que regem e garantem a obrigatoriedade da oferta do atendimento educacional em ambientes hospitalares, bem como realizamos revisão bibliográfica em trabalhos científicos como dissertações, artigos e monografias publicados sobre o tema. A pesquisa no campo se deu através de observação e de entrevistas semiestruturadas que realizamos com os responsáveis pelas classes hospitalares e/ou gestores das unidades hospitalares campo de pesquisa. Por intermédio desta pesquisa, foi possível conhecer a história e surgimento das primeiras classes hospitalares e a importância do acompanhamento educacional por meio dos pedagogos, como também os instrumentos metodológicos utilizados para mediação do ensino escolar para crianças e jovens que por algum motivo de saúde se encontram em internação hospitalar. Foi possível constatar também que, em uma das unidades hospitalares campo de pesquisa não existe classe hospitalar, e na outra apesar da existência da mesma, o serviço não é oferecido em sua totalidade pois a estrutura física da sala não é adequada para seu bom funcionamento. Os resultados obtidos nos fazem refletir sobre a importância da classe hospitalar nas unidades hospitalares, e de como este serviço vem sendo negligenciado pelos poderes públicos, que deveriam fiscalizar e garantir este acompanhamento educacional que é de suma importância para continuação e reintegração no ensino regular de crianças e jovens, que estiveram internados em unidades hospitalares para tratamento médico",Sim,Digital nativo,Sim,Link do Drive,https://drive.google.com/open?id=1jzAbZA3B8ijzqSZLIjnNhbVGrhoXJn4U,Laíne Pereira Fernandes,,,29/05/2026 19:44:43,Não,Form2,,2019.0,33.0,3.0,0.9934017775375664,3.0,False
113,Pedagogia,Pedagogia,PERFIL DOS ESTAGIÁRIOS DO CURSO DE PEDAGOGIA DA UFRR QUE ACOMPANHAM ALUNOS COM AUTISMO EM SALAS REGULARES,,RAFAEL PAIVA RIBEIRO DOS SANTOS,Cinara Franco Rechico Barberena,Não se aplica,Não informado,2019,Não informado,30,Estagiário; Alunos com autismo; Curso de Pedagogia,Sim,"A presente pesquisa tem o objetivo de analisar como se caracteriza o perfil do estagiário do curso de Pedagogia da Universidade Federal de Roraima para acompanhar alunos com características do autismo em salas regulares. Neste caso, direciono a presente pesquisa para a perspectiva qualitativa de caráter descritivo, a partir de questionários contendo perguntas abertas aplicados com acadêmicos do Curso de Pedagogia da UFRR. Foram utilizados como critério para a escolha os estagiários que: tenham experiência de acompanhar alunos com autismos em salas de aulas regulares e ser acadêmico do Curso de Pedagogia da UFRR. Primeiramente, realizei um levantamento quantitativo de sujeitos que compõem minha pesquisa e após, foi entregue o questionário para 8 acadêmicos responderem. Com os dados coletados, elaborei duas categorias de análises: O primeiro é sobre o aluno com autismo e a atuação do estagiário do Curso de Pedagogia da UFRR em espaços escolares acompanhando esse alunado; o segundo é sobre as práticas escolares na perspectiva de uma educação inclusiva envolvendo alunos com características do autismo. Com as análises constatei que o conceito de aluno com autismo, no entendimento dos estagiários participantes desta pesquisa, refere-se a um educando que necessita de atenção e acompanhamento educacional para que se desenvolva de maneira mais satisfatória, e que apresenta dificuldade na comunicação, socialização e no comportamento. Ficou visível que os estagiários compreendem que práticas escolares adequadas podem possibilitar condições de aprendizagem aos alunos com autismo, e também demonstram conhecimento que não podem interferir na didática elaborada pelo professor, e sim que sua atuação destaca-se em auxiliar e dar suporte ao aluno no que precisar. Ao término dessa pesquisa, percebi que o estagiário deve procurar sempre estudar sobre o tema de Educação Especial, para facilitar a identificação de quem é o aluno com autismo, e facilitar o engajamento nas atividades",Sim,Digital nativo,Sim,Link do Drive,https://drive.google.com/open?id=1vVj-AW_J9KWiIV4sgHMFvD6TmmJHe9GY,Laíne Pereira Fernandes,,,29/05/2026 19:51:35,Não,Form2,,2019.0,30.0,3.0,0.9910883153558366,3.0,False
114,Pedagogia,Pedagogia,O ENSINO DA EDUCAÇÃO ESPECIAL NOS CURSOS DE LICENCIATURA DA UNIVERSIDADE FEDERAL DE RORAIMA,,JAQUELINE VILAÇA VIDEIRA,Maria Edith Romano Siems,Não se aplica,Não informado,2019,Não informado,29,Ensino; Educação Especial; Formação de Professores,Sim,"O propósito desta pesquisa foi verificar os cursos de licenciatura disponibilizados pela Universidade Federal de Roraima-UFRR, e averiguar nesses cursos se há o ensino da Educação Especial na perspectiva da educação inclusiva. Para isso, se fez necessária a verificação da matriz curricular dos 21 cursos de licenciatura ofertados pela Universidade Federal de Roraima, através das informações disponibilizadas no Projeto Pedagógico dos Cursos-PPCs, por meio do site da instituição e também junto as coordenações desses cursos. O trabalho situa-se no campo das investigações qualitativas, baseado no panorama da pesquisa exploratória. O estudo dos fundamentos da Educação Especial nos oportuniza a aquisição de conhecimentos relacionados à Educação Especial, nos capacitando para um trabalho visado na educação inclusiva. O trabalho está baseado nas discussões apresentadas por Marques e Marques (2008); Milanesi (2012); Januzzi (2004). Com os dados analisados foi possível entender a conjuntura dos cursos de licenciatura no tocante do ensino da Educação Especial na concepção inclusiva. Com isso, alcançamos nossos objetivos em relação ao enfoque que buscávamos, identificamos de que forma os cursos de formação de professores da UFRR estão tratando da questão da educação do público-alvo da Educação Especial, verificamos o número de cursos de licenciatura ofertados pela UFRR e se são ofertadas disciplinas que abordam a Educação Especial",Sim,Digital nativo,Sim,Link do Drive,https://drive.google.com/open?id=1b2i4xL4q_A1nFrHjApLDJ-fyOIdIDXOw,Laíne Pereira Fernandes,,,29/05/2026 19:58:16,Não,Form2,,2019.0,29.0,3.0,0.988827992368073,3.0,False
115,Insikiran,Insikiran – Ciências da Natureza,O USO DE MAPAS CONCEITUAIS NA APRENDIZAGEM SIGNIFICATIVA SOBREAS INFECÇÕES SEXUALMENTE TRANSMISSÍVEIS POR EDUCANDOS DO8ºANO DE UMA ESCOLA INDÍGENA EM ALTO ALEGRE– RR,,EULLIR DA SILVA BENTO,Mariana Souza da Cunha,Não se aplica,Prof.ª M.ª Mariana Souza da Cunha (Orientadora - Curso de Licenciatura Intercultural - UFRR) Prof. Dr. Ricardo Carvalho dos Santos (Curso de Licenciatura Intercultural - UFRR) Prof.ª Cassiany Ferreira Tavares (Secretaria de Estado da Educação e Desporto – SEED-RR),2025,1º semestre,65,educação indígena; educação sexual; Teoria da Aprendizagem Significativa; Mapas conceituais; Ensino de ciências.,Sim,"O conhecimento sobre infecções sexualmente transmissíveis é essencial para que os indivíduos obtenham uma melhor saúde e qualidade de vida tanto no aspecto individual quanto na coletividade. Com essa perspectiva, este trabalho tem como objetivo geral analisar o processo de ensino e aprendizagem sobre a temática da prevenção de infecções sexualmente transmissíveis utilizando mapas conceituais para promover um aprendizado significativo. A metodologia empregada consistiu na elaboração de uma sequência didática com o tema infecções sexualmente transmissíveis (IST), aplicada a educandos indígenas do 8º ano do ensino fundamental de uma escola indígena localizada no município de Alto Alegre, Roraima. Foram construídos mapas conceituais e aplicados jogos didáticos relacionados ao tema estudado. Na coleta dos dados, foram utilizados questionários para diagnóstico de conhecimento prévio e avaliação final de aprendizagem. Os resultados indicam que as ferramentas de ensino utilizadas neste trabalho, em especial a construção de mapas conceituais, proporcionam um aprendizado mais dinâmico e duradouro, favorecendo a retenção desse conhecimento na parte cognitiva do aluno. Além disso, a utilização de jogos didáticos amplia e favorece ainda mais a construção do conhecimento por parte do aluno. Ressaltamos que a implementação de nossos meios de transposição didática é essencial para que o aluno seja protagonista e ativo na construção do conhecimento científico.",Sim,Digital nativo,Sim,Link do Drive,https://drive.google.com/open?id=1UPAqlsR74-btq09WcoTUYbXOmVe1HuK5,Laíne Pereira Fernandes,,,29/05/2026 20:19:55,Não,Form2,,2025.0,65.0,2.0,0.9906831716209816,0.0,True
116,Insikiran,Insikiran – Ciências da Natureza,"SABERES TRADICIONAIS NO USO DAS PLANTAS MEDICINAISPELACOMUNIDADE SERRA DO SOL, UIRAMUTÃ – RORAIMA",,GLÊNIO BARBOSA ANDRADE,Ise de Goreth Silva,Não se aplica,Não informado,2025,Não informado,40,Conhecimento e saber tradicional; Escola Indígena; Ensino Aprendizagem; Plantas medicinais; Educação Intercultural,Sim,"Este trabalho tem como objetivo analisar de que forma o projeto Encontro dos Saberes pode contribuir para a valorização e preservação dos saberes tradicionais da comunidade indígena Serra do Sol, com ênfase no uso de plantas medicinais, a fim de salvaguardar a tradição oral. A iniciativa foi desenvolvida com a turma da 3ª série da Educação de Jovens e Adultos (EJA) da Escola Estadual Indígena Joaquim Jones José Ingarikó, localizada na comunidade Serra do Sol (WÎI-TÎPÎ), Terra Indígena Raposa Serra do Sol, no município de Uiramutã, Roraima. O projeto contou com a participação ativa de estudantes e anciãos da comunidade, que compartilharam seus conhecimentos ancestrais. A principal ação foi o registro escrito e audiovisual das rodas de conversa, como forma de preservação da memória coletiva e dos saberes tradicionais, dada a escassez de produção acadêmica realizada pelos próprios Ingarikó. A metodologia adotada foi qualitativa e dividida em três etapas: diagnóstico sobre identidade cultural, sustentabilidade e recursos naturais; elaboração da proposta pedagógica; e execução do plano de ação, incluindo aplicação de questionários aos alunos. Os resultados indicam que o projeto promoveu uma reflexão significativa sobre o valor da medicina tradicional e reforçou a importância do registro dos saberes como forma de valorização da identidade cultural indígena.",Sim,Digital nativo,Sim,Link do Drive,https://drive.google.com/open?id=1iBOc_KU684tI7un7kcEEM8rEAefIqCwL,Laíne Pereira Fernandes,"O título da orientadora não está na folha de rosto, mas consta na seção de agradecimentos; além disso, no TCC há uma folha correspondente à banca examinadora, porém ela não está preenchida com os nomes dos avaliadores.",,30/05/2026 21:10:13,Não,Form2,,2025.0,40.0,2.0,0.9919568212476992,0.0,True
